{
  "$schema": "strategies-schema.json",
  "description": "Analytical strategies for business, marketing, and financial questions. Strategies are reframings — ways of looking at a problem that change what evidence counts and what the answer must do.",
  "usage": "Apply strategies in combination with paradigms and structures. A strategy does not produce a number on its own; it disciplines how the number is produced and defended.",
  "strategies": [
    {
      "id": "top-down-vs-bottom-up",
      "name": "Top-Down vs. Bottom-Up",
      "coreReframe": "Compute the same quantity by starting from an industry total and filtering down, and independently by building up from units, prices, and customers; reconcile the gap.",
      "structuralSignals": [
        "Question involves a market size, addressable revenue, or capacity estimate",
        "Authoritative industry data is available but granular assumptions also exist",
        "Stakeholders distrust a single-source estimate"
      ],
      "whatItUnlocks": [
        "A reality check: large divergence between the two methods signals a hidden assumption",
        "A defensible range rather than a false-precision point estimate",
        "Clear identification of which filter or driver the answer is most sensitive to"
      ],
      "classicExamples": [
        {
          "category": "market-sizing",
          "examples": "Size U.S. tele-health market top-down from total healthcare spend vs. bottom-up from visits × price × adoption."
        },
        {
          "category": "capacity-planning",
          "examples": "Estimate warehouse throughput top-down from industry benchmark vs. bottom-up from pick rate × shifts × headcount."
        }
      ],
      "failureModes": [
        "Building the 'independent' bottom-up estimate from the same data source as the top-down",
        "Reconciling the gap by arbitrary averaging instead of investigating the discrepancy",
        "Reporting only the estimate that matches the preferred narrative"
      ]
    },
    {
      "id": "triangulation",
      "name": "Triangulation",
      "coreReframe": "Estimate the same quantity using three or more methodologically distinct approaches and treat agreement (or disagreement) as evidence about the answer's reliability.",
      "structuralSignals": [
        "Single-method estimates are viewed as unreliable",
        "Multiple independent data sources or methods are available",
        "Stakes justify redundant analysis"
      ],
      "whatItUnlocks": [
        "Robustness: an answer that survives three lenses is more defensible than one produced by a single model",
        "Diagnostic power when methods disagree — the disagreement is itself information",
        "Reduced sensitivity to any single data source's bias"
      ],
      "classicExamples": [
        {
          "category": "valuation",
          "examples": "Value a company via DCF, trading comps, and precedent transactions; report the overlap range."
        },
        {
          "category": "campaign-measurement",
          "examples": "Measure campaign incrementality via holdout test, media-mix model, and pre/post geo-lift."
        }
      ],
      "failureModes": [
        "Methods that share the same underlying bias (all three start from the same forecast)",
        "Averaging across methods instead of investigating why they differ",
        "Cherry-picking the two that agree and discarding the third"
      ]
    },
    {
      "id": "sensitivity-analysis",
      "name": "Sensitivity Analysis",
      "coreReframe": "Instead of defending a point estimate, identify which inputs actually drive the output and by how much, then concentrate evidence and debate on those.",
      "structuralSignals": [
        "A quantitative model with many uncertain inputs",
        "Stakeholders challenging the model's credibility",
        "Research budget is limited and must be prioritized"
      ],
      "whatItUnlocks": [
        "Prioritization of which assumptions actually merit deeper research",
        "Protection against spurious precision — shows where the answer is fragile",
        "A communication tool that separates big levers from irrelevant dials"
      ],
      "classicExamples": [
        {
          "category": "valuation",
          "examples": "DCF tornado showing that terminal-growth and WACC dominate valuation, not year-2 revenue."
        },
        {
          "category": "capital-budgeting",
          "examples": "NPV sensitivity on a factory project showing that utilization swamps labor cost."
        }
      ],
      "failureModes": [
        "Flexing inputs over arbitrary symmetric ranges unrelated to real uncertainty",
        "Ignoring correlations between inputs so joint effects are missed",
        "Treating the tornado as a forecast rather than a diagnostic of the forecast"
      ]
    },
    {
      "id": "benchmark-comparison",
      "name": "Benchmark Comparison",
      "coreReframe": "Interpret a number by comparing it to analogous entities or prior periods rather than evaluating it in isolation; the question becomes 'relative to what' not 'is this good'.",
      "structuralSignals": [
        "Stakeholders ask 'is this number good' with no natural yardstick",
        "Metric is industry-specific and intuition is miscalibrated",
        "Decision depends on relative, not absolute, performance"
      ],
      "whatItUnlocks": [
        "Calibration — transforms a raw number into a percentile or gap",
        "Identification of outperformance or underperformance that demands explanation",
        "A credible narrative for boards and investors"
      ],
      "classicExamples": [
        {
          "category": "saas-metrics",
          "examples": "Evaluate a 6% monthly churn rate against public SaaS peer medians for the same ARR band."
        },
        {
          "category": "equity-research",
          "examples": "Compare a company's operating margin against listed peers to frame a rerating thesis."
        }
      ],
      "failureModes": [
        "Benchmark set is not actually comparable (different business model, geography, scale)",
        "Averaging across a benchmark set that contains extreme outliers",
        "Treating the benchmark as a target rather than a reference point"
      ]
    },
    {
      "id": "stakeholder-weighting",
      "name": "Stakeholder Weighting",
      "coreReframe": "Make explicit whose preferences and costs count, and by how much, before scoring options — so the analysis is transparent about whom it is optimizing for.",
      "structuralSignals": [
        "Multiple stakeholder groups with conflicting interests",
        "A decision matrix that appears objective but hides political trade-offs",
        "Post-decision pushback from groups that feel unrepresented"
      ],
      "whatItUnlocks": [
        "Transparency about whose objectives drive the recommendation",
        "Ability to run the analysis under alternative weight sets and report the sensitivity",
        "Principled handling of customer-vs-shareholder, short-vs-long-term tensions"
      ],
      "classicExamples": [
        {
          "category": "pricing-decision",
          "examples": "Weigh customer value, shareholder returns, and channel-partner margin explicitly before recommending a price change."
        },
        {
          "category": "esg-investing",
          "examples": "Explicit weights on financial return, environmental impact, and governance in a portfolio screen."
        }
      ],
      "failureModes": [
        "Weights set by whoever runs the meeting rather than by governance",
        "Hiding weights inside scoring rubrics so stakeholders cannot audit them",
        "Changing weights mid-analysis to preserve a preferred conclusion"
      ]
    },
    {
      "id": "ev-vs-risk-framing",
      "name": "Expected Value vs. Risk-Adjusted Framing",
      "coreReframe": "Separate the expected outcome of a decision from its distribution; two options with the same EV can differ sharply on downside, volatility, or bankruptcy risk.",
      "structuralSignals": [
        "Outcomes are uncertain and potentially asymmetric",
        "Downside is survival-threatening even if expected value is positive",
        "A decision hides a lottery under a single-number summary"
      ],
      "whatItUnlocks": [
        "Explicit treatment of downside, not just average outcome",
        "Better alignment with investor or corporate risk tolerance",
        "Rejection of positive-EV bets that are unsurvivable on the left tail"
      ],
      "classicExamples": [
        {
          "category": "capital-allocation",
          "examples": "Compare two projects with identical NPV but different cash-flow volatility and worst-case drawdown."
        },
        {
          "category": "options-strategy",
          "examples": "Reject a positive-EV trade because its 5% tail would breach a leverage covenant."
        }
      ],
      "failureModes": [
        "Using expected value alone on decisions where the downside is catastrophic",
        "Over-correcting for risk so that all positive-EV bets become unpalatable",
        "Ignoring path dependency — average outcome hides a sequence that causes ruin"
      ]
    },
    {
      "id": "leading-vs-lagging-indicators",
      "name": "Leading vs. Lagging Indicators",
      "coreReframe": "Separate metrics that describe outcomes already realized (lagging) from metrics that predict future outcomes (leading), and manage against leading ones while reporting both.",
      "structuralSignals": [
        "Performance discussions use results metrics that cannot be changed by next quarter",
        "Teams are surprised by downturns their KPIs did not foreshadow",
        "Operational actions don't clearly map to reported outcomes"
      ],
      "whatItUnlocks": [
        "Earlier detection of problems while they can still be fixed",